{
  "$schema": "http://json-schema.org/draft-07/schema#",
  "$id": "https://vlp.invalid/schemas/events/RatingSubmitted.schema.json",
  "title": "RatingSubmitted",
  "description": "평가가 제출됐다. 코멘트 본문은 싣지 않는다. (명명: PascalCase, 실행계획서 5장. lifecycle_event와의 통일 여부는 JEFLIX [미결])",
  "type": "object",
  "properties": {
    "eventId": {
      "type": "string",
      "format": "uuid"
    },
    "eventType": {
      "const": "RatingSubmitted"
    },
    "version": {
      "const": 1
    },
    "occurredAt": {
      "type": "string",
      "format": "date-time"
    },
    "contractId": {
      "type": "string",
      "format": "uuid"
    },
    "deliveryId": {
      "type": "string",
      "format": "uuid"
    },
    "actor": {
      "type": "object",
      "properties": {
        "role": {
          "type": "string",
          "enum": [
            "customer",
            "karmaster",
            "shop",
            "admin",
            "system"
          ]
        },
        "userId": {
          "type": "string",
          "minLength": 1
        }
      },
      "required": [
        "role",
        "userId"
      ],
      "additionalProperties": false
    },
    "payload": {
      "type": "object",
      "properties": {
        "ratingId": {
          "type": "string",
          "format": "uuid"
        },
        "targetType": {
          "type": "string",
          "enum": [
            "KARMASTER",
            "SHOP",
            "DELIVERY_COMPANY"
          ]
        }
      },
      "required": [
        "ratingId",
        "targetType"
      ],
      "additionalProperties": false
    }
  },
  "required": [
    "eventId",
    "eventType",
    "version",
    "occurredAt",
    "contractId",
    "deliveryId",
    "actor",
    "payload"
  ],
  "additionalProperties": false
}